{
  "reviewed": "2026-08-17",
  "tools": [
    {
      "id": "chatgpt",
      "name": "ChatGPT",
      "provider": "OpenAI",
      "bestFor": "General-purpose AI work, research, writing, analysis and multimodal tasks.",
      "level": "Beginner",
      "type": "Assistant",
      "url": "https://chatgpt.com/",
      "sourceUrl": "https://openai.com/chatgpt/overview/",
      "watch": "Capabilities vary by plan and model; verify workspace privacy and admin controls before company use.",
      "tags": ["general", "research", "writing", "multimodal", "work"]
    },
    {
      "id": "claude",
      "name": "Claude",
      "provider": "Anthropic",
      "bestFor": "Long-form reasoning, research, writing, coding and document-heavy work.",
      "level": "Beginner",
      "type": "Assistant",
      "url": "https://claude.ai/",
      "sourceUrl": "https://www.anthropic.com/claude",
      "watch": "Available capabilities differ across Claude plans and enterprise configurations.",
      "tags": ["reasoning", "research", "writing", "coding", "documents"]
    },
    {
      "id": "gemini",
      "name": "Gemini",
      "provider": "Google",
      "bestFor": "General AI assistance with strong integration into Google products and multimodal workflows.",
      "level": "Beginner",
      "type": "Assistant",
      "url": "https://gemini.google.com/",
      "sourceUrl": "https://gemini.google.com/",
      "watch": "Product features and Workspace availability can vary by account and region.",
      "tags": ["general", "google", "workspace", "multimodal"]
    },
    {
      "id": "m365-copilot",
      "name": "Microsoft 365 Copilot",
      "provider": "Microsoft",
      "bestFor": "AI-assisted work inside Word, Excel, PowerPoint, Outlook, Teams and Microsoft 365.",
      "level": "Beginner",
      "type": "Work suite",
      "url": "https://www.microsoft.com/microsoft-365-copilot",
      "sourceUrl": "https://learn.microsoft.com/en-us/copilot/microsoft-365/",
      "watch": "Value depends heavily on Microsoft 365 data quality, permissions and organisational rollout.",
      "tags": ["microsoft", "office", "enterprise", "work"]
    },
    {
      "id": "notebooklm",
      "name": "NotebookLM",
      "provider": "Google",
      "bestFor": "Source-grounded study, synthesis and questioning across a defined collection of material.",
      "level": "Beginner",
      "type": "Research",
      "url": "https://notebooklm.google.com/",
      "sourceUrl": "https://notebooklm.google/",
      "watch": "Treat generated summaries as aids; verify important conclusions against the supplied sources.",
      "tags": ["research", "documents", "study", "grounding"]
    },
    {
      "id": "cursor",
      "name": "Cursor",
      "provider": "Cursor",
      "bestFor": "AI-assisted software development inside an editor with repository context.",
      "level": "Intermediate",
      "type": "Coding",
      "url": "https://www.cursor.com/",
      "sourceUrl": "https://docs.cursor.com/",
      "watch": "Repository-wide actions still require review, tests, security checks and source-control discipline.",
      "tags": ["coding", "developer", "ide", "agents"]
    }
  ],
  "models": [
    {
      "id": "openai-gpt",
      "name": "GPT family",
      "provider": "OpenAI",
      "access": "Hosted/API",
      "bestFor": "General reasoning, coding, tool use and multimodal application development.",
      "openness": "Closed weights",
      "url": "https://platform.openai.com/docs/models",
      "watch": "Choose a model by task, latency, quality and cost rather than assuming the largest model is always best.",
      "tags": ["reasoning", "coding", "tools", "multimodal"]
    },
    {
      "id": "anthropic-claude",
      "name": "Claude family",
      "provider": "Anthropic",
      "access": "Hosted/API",
      "bestFor": "Reasoning, coding, long-form work and agentic applications.",
      "openness": "Closed weights",
      "url": "https://docs.anthropic.com/en/docs/about-claude/models/overview",
      "watch": "Model availability and capabilities change; use the provider model documentation as the current source.",
      "tags": ["reasoning", "coding", "agents", "documents"]
    },
    {
      "id": "google-gemini",
      "name": "Gemini family",
      "provider": "Google",
      "access": "Hosted/API",
      "bestFor": "Multimodal applications, reasoning and Google ecosystem development.",
      "openness": "Closed weights",
      "url": "https://ai.google.dev/gemini-api/docs/models",
      "watch": "API and product surfaces can expose different model options and limits.",
      "tags": ["multimodal", "reasoning", "google", "developer"]
    },
    {
      "id": "meta-llama",
      "name": "Llama family",
      "provider": "Meta",
      "access": "Open-weight ecosystem",
      "bestFor": "Custom deployment, research and applications that need more control over model hosting.",
      "openness": "Open weights; licence-specific",
      "url": "https://www.llama.com/",
      "watch": "Open weights do not automatically mean open source; inspect the exact licence and deployment obligations.",
      "tags": ["open-weight", "local", "self-hosted", "research"]
    },
    {
      "id": "mistral",
      "name": "Mistral models",
      "provider": "Mistral AI",
      "access": "Hosted and open-weight options",
      "bestFor": "European-hosted options, application development and selected self-hosted use cases.",
      "openness": "Mixed by model",
      "url": "https://docs.mistral.ai/getting-started/models/models_overview/",
      "watch": "Licensing and availability differ between models; verify the exact model rather than the family name.",
      "tags": ["open-weight", "api", "enterprise", "europe"]
    },
    {
      "id": "qwen",
      "name": "Qwen family",
      "provider": "Alibaba Cloud / Qwen",
      "access": "Hosted and open-weight ecosystem",
      "bestFor": "Research, multilingual work and self-hosted experimentation where the selected licence fits.",
      "openness": "Mixed by model",
      "url": "https://qwenlm.github.io/",
      "watch": "Check the exact repository, licence, model card and serving requirements before production use.",
      "tags": ["open-weight", "multilingual", "local", "research"]
    }
  ],
  "courses": [
    {
      "id": "openai-ai-foundations",
      "title": "AI Foundations",
      "provider": "OpenAI Academy",
      "level": "Beginner",
      "audience": "People new to AI or wanting stronger workplace fundamentals.",
      "duration": "~70 minutes",
      "cost": "Free",
      "certificate": "Course completion certificate",
      "url": "https://academy.openai.com/public/courses/ai-foundations-juzjs?autoEnroll=true",
      "sourceUrl": "https://academy.openai.com/pages/courses",
      "rating": 9.3,
      "why": "A concise hands-on introduction that teaches prompting, context, review and responsible workplace use around a real task.",
      "value": "Strong first course for non-technical staff because it moves quickly from concepts into practical habits.",
      "skip": "Skip if you already use AI confidently every day and want technical implementation depth.",
      "path": "start-here",
      "verified": "2026-08-17"
    },
    {
      "id": "openai-applied-foundations",
      "title": "Applied AI Foundations",
      "provider": "OpenAI Academy",
      "level": "Intermediate",
      "audience": "Active AI users who want repeatable workflows instead of isolated chats.",
      "duration": "Self-paced",
      "cost": "Free",
      "certificate": "Course completion certificate",
      "url": "https://academy.openai.com/pages/courses",
      "sourceUrl": "https://academy.openai.com/pages/courses",
      "rating": 9.2,
      "why": "Focuses on breaking recurring work into steps, identifying where AI helps and adding review points.",
      "value": "Useful bridge from ‘prompting’ to workflow thinking for knowledge workers and team champions.",
      "skip": "Skip if your priority is API development, model training or deep software engineering.",
      "path": "work-smarter",
      "verified": "2026-08-17"
    },
    {
      "id": "openai-agents-workflows",
      "title": "Agents and Workflows",
      "provider": "OpenAI Academy",
      "level": "Intermediate",
      "audience": "Comfortable AI users beginning to direct agents and structured workflows.",
      "duration": "Self-paced",
      "cost": "Free",
      "certificate": "Course completion certificate",
      "url": "https://academy.openai.com/pages/courses",
      "sourceUrl": "https://academy.openai.com/pages/courses",
      "rating": 9.1,
      "why": "Teaches structured work, context, boundaries, output definition and human review rather than treating agents as magic automation.",
      "value": "Strong conceptual preparation before building or approving workplace agents.",
      "skip": "Developers needing production orchestration code should pair it with technical SDK documentation and AI Compass builder guides.",
      "path": "enterprise-ai-builder",
      "verified": "2026-08-17"
    },
    {
      "id": "anthropic-ai-fluency",
      "title": "AI Fluency: Frameworks and Foundations",
      "provider": "Anthropic",
      "level": "Beginner",
      "audience": "Anyone who wants transferable skills for collaborating with AI rather than product-specific button training.",
      "duration": "12 lessons · 3–4 hours",
      "cost": "Free",
      "certificate": "Not the primary reason to take it",
      "url": "https://www.anthropic.com/ai-fluency/overview",
      "sourceUrl": "https://www.anthropic.com/ai-fluency/overview",
      "rating": 9.4,
      "why": "Its 4D framework—Delegation, Description, Discernment and Diligence—gives learners a durable mental model for effective and responsible AI use.",
      "value": "One of the strongest vendor-created courses for skills that remain useful across multiple AI tools.",